{
  "$schema": "https://json-schema.org/draft/2020-12/schema",
  "$id": "https://hey.food/schemas/v1/agent-household-proposal-presentation.schema.json",
  "title": "heyfood agent household proposal presentation v1",
  "description": "Disclosure-filtered status only. This document never authorizes commit.",
  "type": "object",
  "additionalProperties": false,
  "required": [
    "schema_version",
    "proposal_ref",
    "operation",
    "state",
    "projection",
    "disclosure_generation",
    "affected_member_ref",
    "affected_member_label",
    "changes",
    "consequences",
    "recoverability",
    "created_at",
    "expires_at",
    "human_status",
    "handoff_command",
    "handoff_instruction"
  ],
  "properties": {
    "schema_version": { "const": 1 },
    "proposal_ref": { "type": "string", "format": "uuid" },
    "operation": { "enum": ["add", "edit", "archive", "restore", "scope"] },
    "state": {
      "enum": [
        "prepared",
        "awaiting_local_input",
        "awaiting_local_review",
        "committing",
        "committed",
        "cancelled",
        "expired",
        "stale",
        "rejected",
        "proven_uncommitted",
        "reconciliation_required"
      ]
    },
    "projection": { "enum": ["content_free", "roster", "profile"] },
    "disclosure_generation": { "type": "integer", "minimum": 0 },
    "affected_member_ref": {
      "type": ["string", "null"],
      "minLength": 1,
      "maxLength": 256
    },
    "affected_member_label": {
      "type": ["string", "null"],
      "minLength": 1,
      "maxLength": 320,
      "pattern": "^[^\\u0000-\\u001f\\u007f]+$"
    },
    "changes": {
      "type": "array",
      "maxItems": 128,
      "items": { "$ref": "#/$defs/change" }
    },
    "consequences": {
      "type": "array",
      "maxItems": 8,
      "uniqueItems": true,
      "items": {
        "enum": ["conversation_continuity_reset", "active_scope_changed", "member_archived", "member_restored"]
      }
    },
    "recoverability": {
      "enum": ["editable_before_save", "reversible_archive", "new_proposal_required_after_save"]
    },
    "created_at": { "$ref": "#/$defs/timestamp" },
    "expires_at": { "$ref": "#/$defs/timestamp" },
    "human_status": { "type": "string", "minLength": 1, "maxLength": 160 },
    "handoff_command": { "const": "heyfood" },
    "handoff_instruction": {
      "const": "Open `/household changes` to review this change locally."
    }
  },
  "$defs": {
    "change_value": {
      "type": "string",
      "minLength": 1,
      "maxLength": 256,
      "pattern": "^[^\\u0000-\\u001f\\u007f]+$"
    },
    "change": {
      "type": "object",
      "additionalProperties": false,
      "required": ["field", "before", "after"],
      "properties": {
        "field": {
          "enum": ["display_label", "relationship", "lifecycle", "diet_styles", "allergies", "restrictions", "health_conditions", "avoid_ingredients"]
        },
        "before": { "type": "array", "maxItems": 64, "items": { "$ref": "#/$defs/change_value" } },
        "after": { "type": "array", "maxItems": 64, "items": { "$ref": "#/$defs/change_value" } }
      }
    },
    "timestamp": {
      "type": "string",
      "pattern": "^[0-9]{4}-[0-9]{2}-[0-9]{2}T[0-9]{2}:[0-9]{2}:[0-9]{2}\\.[0-9]{3}Z$"
    }
  },
  "oneOf": [
    { "properties": { "state": { "const": "prepared" }, "human_status": { "const": "Getting this change ready…" } }, "required": ["state", "human_status"] },
    { "properties": { "state": { "const": "awaiting_local_input" }, "human_status": { "const": "More information needed" } }, "required": ["state", "human_status"] },
    { "properties": { "state": { "const": "awaiting_local_review" }, "human_status": { "const": "Ready for your review" } }, "required": ["state", "human_status"] },
    { "properties": { "state": { "const": "committing" }, "human_status": { "const": "Saving securely…" } }, "required": ["state", "human_status"] },
    { "properties": { "state": { "const": "committed" }, "human_status": { "const": "Saved" } }, "required": ["state", "human_status"] },
    { "properties": { "state": { "const": "cancelled" }, "human_status": { "const": "Cancelled — nothing was saved" } }, "required": ["state", "human_status"] },
    { "properties": { "state": { "const": "expired" }, "human_status": { "const": "Expired — start a new change" } }, "required": ["state", "human_status"] },
    { "properties": { "state": { "const": "stale" }, "human_status": { "const": "Household changed — review a fresh proposal" } }, "required": ["state", "human_status"] },
    { "properties": { "state": { "const": "rejected" }, "human_status": { "const": "Can't use this change" } }, "required": ["state", "human_status"] },
    { "properties": { "state": { "const": "proven_uncommitted" }, "human_status": { "const": "Not saved — heyfood verified no household change was made" } }, "required": ["state", "human_status"] },
    { "properties": { "state": { "const": "reconciliation_required" }, "human_status": { "const": "Checking whether this was saved…" } }, "required": ["state", "human_status"] }
  ],
  "allOf": [
    {
      "if": {
        "properties": { "projection": { "const": "content_free" } },
        "required": ["projection"]
      },
      "then": {
        "properties": {
          "affected_member_ref": { "type": "null" },
          "affected_member_label": { "type": "null" },
          "changes": { "maxItems": 0 },
          "consequences": { "maxItems": 0 }
        }
      }
    },
    {
      "if": {
        "properties": { "projection": { "const": "roster" } },
        "required": ["projection"]
      },
      "then": {
        "properties": {
          "changes": {
            "items": {
              "allOf": [
                { "$ref": "#/$defs/change" },
                {
                  "properties": {
                    "field": {
                      "not": { "enum": ["diet_styles", "allergies", "restrictions", "health_conditions", "avoid_ingredients"] }
                    }
                  }
                }
              ]
            }
          }
        }
      }
    },
    {
      "if": {
        "properties": { "operation": { "const": "scope" } },
        "required": ["operation"]
      },
      "then": {
        "properties": {
          "projection": { "const": "content_free" },
          "affected_member_ref": { "type": "null" },
          "affected_member_label": { "type": "null" },
          "changes": { "maxItems": 0 },
          "consequences": { "maxItems": 0 }
        }
      }
    }
  ]
}
