{
  "schema_version": 1,
  "proposal_ref": "20000000-0000-4000-8000-000000000001",
  "operation": "edit",
  "state": "awaiting_local_input",
  "projection": "content_free",
  "disclosure_generation": 4,
  "affected_member_ref": null,
  "affected_member_label": null,
  "changes": [],
  "consequences": [],
  "recoverability": "new_proposal_required_after_save",
  "created_at": "2026-08-02T12:00:00.000Z",
  "expires_at": "2026-08-02T12:10:00.000Z",
  "human_status": "More information needed",
  "handoff_command": "heyfood",
  "handoff_instruction": "Open `/household changes` to review this change locally."
}
